[
  {
    "id": "MSG1",
    "label": "CreateTaskCommand",
    "category": "command",
    "description": "EndUser requests creation of a new task with required and optional attributes.",
    "producer": "A1",
    "consumer": "A2",
    "payload": [
      {
        "id": "DE1",
        "label": "Task",
        "refConceptId": "DE1",
        "constraint": "Must include at least a non-empty title; description and due date are optional.",
        "notes": "Represents the task fields provided in the creation UI before persistence.",
        "isNew": false
      }
    ],
    "constraints": [
      {
        "id": "C-MSG1-1",
        "label": "Task title required on creation",
        "constraint": "TodoApplication must reject CreateTaskCommand if the provided Task title is empty or whitespace.",
        "notes": "",
        "isNew": true
      }
    ],
    "justification": "User needs to create simple to-do items with at least a title, and optionally a description and due date.",
    "anchors": [
      "AN3"
    ]
  },
  {
    "id": "MSG2",
    "label": "TaskCreatedResponse",
    "category": "response",
    "description": "TodoApplication confirms that a new task has been created and persisted.",
    "producer": "A2",
    "consumer": "A1",
    "payload": [
      {
        "id": "DE1",
        "label": "CreatedTask",
        "refConceptId": "DE1",
        "constraint": "Includes any system-assigned identifiers and initial completion status.",
        "notes": "Represents the task as stored in the LocalTaskStore after creation.",
        "isNew": false
      }
    ],
    "constraints": [],
    "justification": "The user should see the newly created task appear in the main list view after creation.",
    "anchors": [
      "AN3",
      "AN5"
    ]
  },
  {
    "id": "MSG3",
    "label": "EditTaskCommand",
    "category": "command",
    "description": "EndUser requests modification of an existing task’s attributes.",
    "producer": "A1",
    "consumer": "A2",
    "payload": [
      {
        "id": "DE1",
        "label": "UpdatedTask",
        "refConceptId": "DE1",
        "constraint": "Must reference an existing task and specify one or more fields to change.",
        "notes": "Includes updated title, description, due date, category, or other editable attributes.",
        "isNew": false
      }
    ],
    "constraints": [
      {
        "id": "C-MSG3-1",
        "label": "Task must exist before edit",
        "constraint": "TodoApplication must ensure the target Task exists in LocalTaskStore before applying edits.",
        "notes": "",
        "isNew": true
      }
    ],
    "justification": "Users can edit tasks as part of managing their to-do items over time.",
    "anchors": [
      "AN6"
    ]
  },
  {
    "id": "MSG4",
    "label": "TaskEditedEvent",
    "category": "event",
    "description": "TodoApplication notifies the EndUser that a task has been successfully updated.",
    "producer": "A2",
    "consumer": "A1",
    "payload": [
      {
        "id": "DE1",
        "label": "EditedTask",
        "refConceptId": "DE1",
        "constraint": "Reflects the latest persisted state of the task after editing.",
        "notes": "",
        "isNew": false
      }
    ],
    "constraints": [],
    "justification": "The main list view must reflect updated task attributes after edits.",
    "anchors": [
      "AN5",
      "AN6"
    ]
  },
  {
    "id": "MSG5",
    "label": "SetTaskCompletionStatusCommand",
    "category": "command",
    "description": "EndUser requests to mark a task complete or incomplete.",
    "producer": "A1",
    "consumer": "A2",
    "payload": [
      {
        "id": "DE1",
        "label": "TaskWithNewCompletionStatus",
        "refConceptId": "DE1",
        "constraint": "Identifies the target task and specifies the new completion status flag.",
        "notes": "Other task attributes may be unchanged.",
        "isNew": false
      }
    ],
    "constraints": [
      {
        "id": "C-MSG5-1",
        "label": "Completion status toggle validity",
        "constraint": "TodoApplication must handle idempotent completion status changes (setting a status to its current value has no adverse effect).",
        "notes": "",
        "isNew": true
      }
    ],
    "justification": "Users must be able to mark tasks complete or incomplete and see that reflected in filters.",
    "anchors": [
      "AN6",
      "AN7"
    ]
  },
  {
    "id": "MSG6",
    "label": "TaskCompletionStatusChangedEvent",
    "category": "event",
    "description": "TodoApplication notifies the EndUser that a task’s completion status has changed.",
    "producer": "A2",
    "consumer": "A1",
    "payload": [
      {
        "id": "DE1",
        "label": "TaskWithCompletionStatus",
        "refConceptId": "DE1",
        "constraint": "Includes the updated completion status and any related derived indicators in the view.",
        "notes": "",
        "isNew": false
      }
    ],
    "constraints": [],
    "justification": "Filtering by completion status relies on up-to-date completion information in the main list.",
    "anchors": [
      "AN5",
      "AN6",
      "AN7"
    ]
  },
  {
    "id": "MSG7",
    "label": "DeleteTaskCommand",
    "category": "command",
    "description": "EndUser requests deletion of an existing task.",
    "producer": "A1",
    "consumer": "A2",
    "payload": [
      {
        "id": "DE1",
        "label": "TaskToDelete",
        "refConceptId": "DE1",
        "constraint": "Identifies the task to remove from LocalTaskStore.",
        "notes": "May contain just the identifier in an implementation, but conceptually refers to the Task entity.",
        "isNew": false
      }
    ],
    "constraints": [
      {
        "id": "C-MSG7-1",
        "label": "Task must exist before deletion",
        "constraint": "TodoApplication must ensure the referenced task exists before deletion; deleting a non-existent task is a no-op or error.",
        "notes": "",
        "isNew": true
      }
    ],
    "justification": "Deleting tasks is part of the task lifecycle described in the specification.",
    "anchors": [
      "AN6"
    ]
  },
  {
    "id": "MSG8",
    "label": "TaskDeletedEvent",
    "category": "event",
    "description": "TodoApplication informs the EndUser that a task has been deleted and is no longer visible in the main list.",
    "producer": "A2",
    "consumer": "A1",
    "payload": [
      {
        "id": "DE1",
        "label": "DeletedTaskReference",
        "refConceptId": "DE1",
        "constraint": "Contains at least the identifier of the deleted task so the UI can remove it from display.",
        "notes": "",
        "isNew": false
      }
    ],
    "constraints": [],
    "justification": "The main list view should update to remove tasks when they are deleted.",
    "anchors": [
      "AN5",
      "AN6"
    ]
  },
  {
    "id": "MSG9",
    "label": "CreateCategoryCommand",
    "category": "command",
    "description": "EndUser requests creation of a new category for organizing tasks.",
    "producer": "A1",
    "consumer": "A2",
    "payload": [
      {
        "id": "DE2",
        "label": "CategoryToCreate",
        "refConceptId": "DE2",
        "constraint": "Includes a non-empty category name.",
        "notes": "",
        "isNew": false
      }
    ],
    "constraints": [
      {
        "id": "C-MSG9-1",
        "label": "Category name required",
        "constraint": "TodoApplication must reject CreateCategoryCommand if the category name is empty or whitespace.",
        "notes": "",
        "isNew": true
      }
    ],
    "justification": "Users can create simple lists or categories like Work and Personal.",
    "anchors": [
      "AN4"
    ]
  },
  {
    "id": "MSG10",
    "label": "CategoryCreatedEvent",
    "category": "event",
    "description": "TodoApplication notifies the EndUser that a new category has been created and is available for assignment and filtering.",
    "producer": "A2",
    "consumer": "A1",
    "payload": [
      {
        "id": "DE2",
        "label": "CreatedCategory",
        "refConceptId": "DE2",
        "constraint": "Includes any system-assigned identifiers and the category name.",
        "notes": "",
        "isNew": false
      }
    ],
    "constraints": [],
    "justification": "New categories must appear in the UI so users can organize tasks into them.",
    "anchors": [
      "AN4",
      "AN7"
    ]
  },
  {
    "id": "MSG11",
    "label": "RenameCategoryCommand",
    "category": "command",
    "description": "EndUser requests to change the name of an existing category.",
    "producer": "A1",
    "consumer": "A2",
    "payload": [
      {
        "id": "DE2",
        "label": "CategoryRenameRequest",
        "refConceptId": "DE2",
        "constraint": "Includes the identifier of the category and the new non-empty name.",
        "notes": "",
        "isNew": false
      }
    ],
    "constraints": [
      {
        "id": "C-MSG11-1",
        "label": "Category must exist before rename",
        "constraint": "TodoApplication must ensure the target category exists before applying a rename.",
        "notes": "",
        "isNew": true
      }
    ],
    "justification": "Renaming categories is part of the basic category lifecycle.",
    "anchors": [
      "AN4"
    ]
  },
  {
    "id": "MSG12",
    "label": "CategoryRenamedEvent",
    "category": "event",
    "description": "TodoApplication informs the EndUser that a category has been renamed.",
    "producer": "A2",
    "consumer": "A1",
    "payload": [
      {
        "id": "DE2",
        "label": "RenamedCategory",
        "refConceptId": "DE2",
        "constraint": "Reflects the updated category name and identifier.",
        "notes": "",
        "isNew": false
      }
    ],
    "constraints": [],
    "justification": "Category lists and filters in the UI need to show the new category name.",
    "anchors": [
      "AN4",
      "AN7"
    ]
  },
  {
    "id": "MSG13",